{
  "id": "layer0_sample_0001",
  "language": "si",
  "title": "Sinhala public-domain sample (placeholder)",
  "source": {
    "type": "public_domain",
    "citation": "Placeholder sample for Project Serendib repo templates."
  },
  "license": "Public Domain (placeholder)",
  "created_at": "2026-03-17",
  "tags": ["sample", "template", "layer0"]
}

